{
  "$schema": "./schemas/toolchain-lock.schema.json",
  "manifestVersion": 1,
  "state": "locked",
  "supportedTargets": ["win32-x64", "linux-x64", "darwin-x64", "darwin-arm64"],
  "tools": {
    "mangabind": {
      "sourceRepo": "https://github.com/gustavommcv/mangabind",
      "pin": {
        "releaseTag": "v0.10.0",
        "protocolVersion": "1",
        "checksums": {
          "assetName": "checksums.txt",
          "url": "https://github.com/gustavommcv/mangabind/releases/download/v0.10.0/checksums.txt",
          "sha256": "dddd15c8c268d68c4b57da9af66c313c3072ae92a1258253caa27131764309bd"
        },
        "artifacts": {
          "win32-x64": {
            "assetName": "mangabind_windows_amd64.zip",
            "url": "https://github.com/gustavommcv/mangabind/releases/download/v0.10.0/mangabind_windows_amd64.zip",
            "archiveSha256": "e538b76640fbfddaa245429d38b7f142248c479aad2fe272ebf142afc9071a2b",
            "executableSha256": "058b7a133a102dc56c2d41123af0794c1dc3c7b6236c4566e5766d60dfc31ace"
          },
          "linux-x64": {
            "assetName": "mangabind_linux_amd64.tar.gz",
            "url": "https://github.com/gustavommcv/mangabind/releases/download/v0.10.0/mangabind_linux_amd64.tar.gz",
            "archiveSha256": "297245b6691cba7b94e863bd28a2ed9b87c740de2e69d5e5eb38e4cd124a5546",
            "executableSha256": "edf898293fc2428783ed59f031a26792ee8a9b285e7cfbb8c8177b9a0273d7fc"
          },
          "darwin-x64": {
            "assetName": "mangabind_darwin_amd64.tar.gz",
            "url": "https://github.com/gustavommcv/mangabind/releases/download/v0.10.0/mangabind_darwin_amd64.tar.gz",
            "archiveSha256": "1455cf997026b4ae86177ea96fcfc35532d6715c9466e86c3d9f5b1a65f39486",
            "executableSha256": "f986866521ef1ddeb81a657fb67a957d34d86c6c17bfc55fbfccacfe80fbe49e"
          },
          "darwin-arm64": {
            "assetName": "mangabind_darwin_arm64.tar.gz",
            "url": "https://github.com/gustavommcv/mangabind/releases/download/v0.10.0/mangabind_darwin_arm64.tar.gz",
            "archiveSha256": "b81f542fde26771d187f62172581c9f2255f48234327c1b22b220d3b1cd5f146",
            "executableSha256": "ecf022afd8ed95b61be7a1717efdc73d757fd0aa2bd3c63485c9ac56fa369e63"
          }
        }
      }
    },
    "mangaprep": {
      "sourceRepo": "https://github.com/gustavommcv/mangaprep",
      "pin": {
        "releaseTag": "v0.9.0",
        "protocolVersion": "1",
        "checksums": {
          "assetName": "checksums.txt",
          "url": "https://github.com/gustavommcv/mangaprep/releases/download/v0.9.0/checksums.txt",
          "sha256": "d06d2b3dda9172e9bc9b3e95349847bb3d07b369bbab01ce468d79937006141c"
        },
        "artifacts": {
          "win32-x64": {
            "assetName": "mangaprep-x86_64-pc-windows-msvc.zip",
            "url": "https://github.com/gustavommcv/mangaprep/releases/download/v0.9.0/mangaprep-x86_64-pc-windows-msvc.zip",
            "archiveSha256": "21d584091ff6603cece45901c36899e682d7bebc963908857285f2f1aadb804b",
            "executableSha256": "099f2bf096a7a28c431eec3f012af1de1a3ea72a9453160d16a20b342c378ad4"
          },
          "linux-x64": {
            "assetName": "mangaprep-x86_64-unknown-linux-musl.tar.gz",
            "url": "https://github.com/gustavommcv/mangaprep/releases/download/v0.9.0/mangaprep-x86_64-unknown-linux-musl.tar.gz",
            "archiveSha256": "b895433dbf2d64efbe467386d98aad758e1448f328dfcc9409aa01a0f326ba62",
            "executableSha256": "3f79be77639f84250cd6d1c13d1bffdd48623d17e8b9fd9efff7eb5ccbbd9381"
          },
          "darwin-x64": {
            "assetName": "mangaprep-x86_64-apple-darwin.tar.gz",
            "url": "https://github.com/gustavommcv/mangaprep/releases/download/v0.9.0/mangaprep-x86_64-apple-darwin.tar.gz",
            "archiveSha256": "214d8a77014d01820e6525382dd3b71bba57bcff45cdf49ac409b8c56f9ebef1",
            "executableSha256": "b955fa06c78b91aaa7e82d64159523a3c6c49491413b071cfd6cf9137629dcd6"
          },
          "darwin-arm64": {
            "assetName": "mangaprep-aarch64-apple-darwin.tar.gz",
            "url": "https://github.com/gustavommcv/mangaprep/releases/download/v0.9.0/mangaprep-aarch64-apple-darwin.tar.gz",
            "archiveSha256": "faa9cc5ad124d9489d4fad19b4240d8eedf1c2a2e0f80961d5045d6503718323",
            "executableSha256": "103fd4a72963e39a8a7ab046cf6b1bb3bc3a20d3a2c9d59acb36fa7b2e800c80"
          }
        }
      }
    }
  }
}
